{
  "diagnostics": [
    {
      "code": "context_built",
      "message": "context build pipeline complete",
      "severity": "info"
    }
  ],
  "guards": {
    "merge-readiness": {
      "guard_id": "merge-readiness",
      "ok": false,
      "reason": "missing or invalid github.reviews.review_threads_unresolved"
    }
  },
  "knowledge": {
    "entries": []
  },
  "observation": {
    "degraded": false,
    "meta": {
      "view": "full"
    },
    "schema_version": "0.8.0",
    "signals": {
      "git": {
        "ahead_of_upstream": 0,
        "behind_of_upstream": 0,
        "branch": "test/74-fsm-golden-fixtures-and-ci",
        "detached_head": false,
        "has_upstream": false,
        "stale_remote_branches_count": 0,
        "stash_count": 0,
        "uncommitted_files": 0,
        "working_tree_clean": true
      },
      "github": {
        "pull_requests": {
          "current_branch": "test/74-fsm-golden-fixtures-and-ci",
          "merge_state_status": "dirty",
          "open_count": 1,
          "pr_exists_for_branch": true,
          "pr_number_for_branch": 74
        },
        "reviews": {
          "bot_review_diagnostics": {
            "bot_review_block_reason": "review_paused",
            "bot_review_blocked": true
          },
          "bot_reviewer_status": [
            {
              "id": "coderabbit",
              "login": "coderabbitai[bot]",
              "required": true,
              "status": "review_paused"
            }
          ],
          "review_decisions_changes_requested": 1
        }
      }
    }
  },
  "routes": [
    {
      "kind": "resolved",
      "priority": 28,
      "route_candidates": [
        {
          "priority": 28,
          "route_id": "user-wait-bot-paused",
          "rule_id": "route_wait_bot_paused"
        }
      ],
      "route_id": "user-wait-bot-paused",
      "rule_id": "route_wait_bot_paused",
      "target_id": "user-wait-bot-paused"
    }
  ],
  "schema_version": "0.8.0",
  "state": {
    "kind": "resolved",
    "priority": 12,
    "rule_id": "review_paused",
    "state_id": "waiting_bot_paused",
    "target_id": "waiting_bot_paused"
  }
}
