{
  "diagnostics": [
    {
      "code": "context_built",
      "message": "context build pipeline complete",
      "severity": "info"
    }
  ],
  "guards": {
    "merge-readiness": {
      "guard_id": "merge-readiness",
      "ok": false,
      "reason": "missing github.reviews.bot_review_diagnostics.bot_review_pending (fail closed)"
    }
  },
  "knowledge": {
    "entries": []
  },
  "observation": {
    "degraded": false,
    "meta": {
      "view": "full"
    },
    "schema_version": "0.8.0",
    "signals": {
      "git": {
        "ahead_of_upstream": 0,
        "behind_of_upstream": 0,
        "branch": "test/74-fsm-golden-fixtures-and-ci",
        "detached_head": false,
        "has_upstream": false,
        "stale_remote_branches_count": 0,
        "stash_count": 0,
        "uncommitted_files": 0,
        "working_tree_clean": true
      },
      "github": {
        "pull_requests": {
          "current_branch": "test/74-fsm-golden-fixtures-and-ci",
          "merge_state_status": "dirty",
          "open_count": 1,
          "pr_exists_for_branch": true,
          "pr_number_for_branch": 74
        },
        "reviews": {
          "bot_review_diagnostics": {
            "bot_review_block_reason": "rate_limited",
            "bot_review_blocked": true,
            "non_thread_findings_present": true
          },
          "bot_reviewer_status": [
            {
              "id": "coderabbit",
              "login": "coderabbitai[bot]",
              "rate_limit_remaining_seconds": 120,
              "required": true,
              "status": "rate_limited"
            }
          ],
          "pagination_incomplete": false,
          "review_decisions_approved": 0,
          "review_decisions_changes_requested": 0,
          "review_decisions_total": 0,
          "review_decisions_truncated": false,
          "review_threads_unresolved": 0
        }
      }
    }
  },
  "routes": [
    {
      "kind": "resolved",
      "priority": 27,
      "route_candidates": [
        {
          "priority": 27,
          "route_id": "user-wait-bot-quota",
          "rule_id": "route_wait_bot_quota"
        }
      ],
      "route_id": "user-wait-bot-quota",
      "rule_id": "route_wait_bot_quota",
      "target_id": "user-wait-bot-quota"
    }
  ],
  "schema_version": "0.8.0",
  "state": {
    "kind": "resolved",
    "priority": 11,
    "rule_id": "rate_limited",
    "state_id": "waiting_bot_rate_limited",
    "target_id": "waiting_bot_rate_limited"
  }
}
